{
  "dataset_version": "1.0.0",
  "scope": "Sous-ensemble de 20 questions représentatives destiné aux tests de non-régression. Il ne constitue pas une cartographie exhaustive des deux PDF.",
  "documents": [
    {
      "id": "physics-slides",
      "filename": "QuestionsPhysique2Elec.pdf",
      "language": "fr",
      "document_type": "slides",
      "page_count": 60
    },
    {
      "id": "calculus-question-bank",
      "filename": "GQbysubject_pdfversion.pdf",
      "language": "en",
      "document_type": "dense_question_bank",
      "page_count": 53
    }
  ],
  "cases": [
    {
      "case_id": "phys-002",
      "document_id": "physics-slides",
      "source_label": "Diapositive 2",
      "mapping_fragment": {
        "temporary_id": "segment-phys-002",
        "question_number": null,
        "question_pages": [
          2
        ],
        "answer_pages": [],
        "feedback_pages": [],
        "contains_essential_image": true,
        "question_type_hint": "single_choice",
        "page_regions": [
          {
            "page": 2,
            "role": "question",
            "bbox": {
              "x": 0.03,
              "y": 0.17,
              "width": 0.93,
              "height": 0.72
            }
          },
          {
            "page": 2,
            "role": "essential_image",
            "bbox": {
              "x": 0.55,
              "y": 0.3,
              "width": 0.32,
              "height": 0.48
            }
          }
        ],
        "confidence": 0.98,
        "warnings": []
      },
      "expected_question": {
        "id": "q-phys-002",
        "segment_id": "segment-phys-002",
        "type": "single_choice",
        "title": {
          "content": "Quand l’ampoule éclaire",
          "origin": "generated_by_model"
        },
        "content_format": "markdown-latex",
        "statement": "Quand l’ampoule éclaire :\n\n![Schéma du circuit](asset:phys-002-circuit)",
        "choices": [
          {
            "id": "choice-a",
            "content": "Elle prend du courant"
          },
          {
            "id": "choice-b",
            "content": "Elle donne du courant"
          },
          {
            "id": "choice-c",
            "content": "Aucune des réponses précédentes"
          }
        ],
        "correct_choice_ids": [],
        "correct_answer_origin": "not_available",
        "feedback": {
          "content": "",
          "origin": "not_available"
        },
        "images": [
          {
            "id": "asset-phys-002-circuit",
            "role": "essential",
            "source_page": 2,
            "bbox": {
              "x": 0.55,
              "y": 0.3,
              "width": 0.32,
              "height": 0.48
            },
            "alt_text": "Circuit fermé comportant une pile et une ampoule",
            "insertion_token": "asset:phys-002-circuit"
          }
        ],
        "source_pages": [
          2
        ],
        "confidence": 0.98,
        "warnings": [
          "La réponse correcte n’est pas explicitement indiquée dans le document."
        ],
        "status": "draft"
      },
      "rationale": "Cas simple : une question par diapositive et un schéma indispensable."
    },
    {
      "case_id": "phys-003",
      "document_id": "physics-slides",
      "source_label": "Diapositive 3",
      "mapping_fragment": {
        "temporary_id": "segment-phys-003",
        "question_number": null,
        "question_pages": [
          3
        ],
        "answer_pages": [],
        "feedback_pages": [],
        "contains_essential_image": true,
        "question_type_hint": "single_choice",
        "page_regions": [
          {
            "page": 3,
            "role": "question",
            "bbox": {
              "x": 0.03,
              "y": 0.1,
              "width": 0.94,
              "height": 0.8
            }
          },
          {
            "page": 3,
            "role": "essential_image",
            "bbox": {
              "x": 0.38,
              "y": 0.22,
              "width": 0.48,
              "height": 0.39
            }
          }
        ],
        "confidence": 0.98,
        "warnings": []
      },
      "expected_question": {
        "id": "q-phys-003",
        "segment_id": "segment-phys-003",
        "type": "single_choice",
        "title": {
          "content": "Deux ampoules identiques sont alimentées par une pile suivant le sché…",
          "origin": "generated_by_model"
        },
        "content_format": "markdown-latex",
        "statement": "Deux ampoules identiques sont alimentées par une pile suivant le schéma ci-dessous.\n\n![Circuit avec interrupteur](asset:phys-003-circuit)\n\nSi je ferme l’interrupteur, l’ampoule A :",
        "choices": [
          {
            "id": "choice-a",
            "content": "Éclairera plus"
          },
          {
            "id": "choice-b",
            "content": "Éclairera moins"
          },
          {
            "id": "choice-c",
            "content": "Éclairera autant"
          }
        ],
        "correct_choice_ids": [],
        "correct_answer_origin": "not_available",
        "feedback": {
          "content": "",
          "origin": "not_available"
        },
        "images": [
          {
            "id": "asset-phys-003-circuit",
            "role": "essential",
            "source_page": 3,
            "bbox": {
              "x": 0.38,
              "y": 0.22,
              "width": 0.48,
              "height": 0.39
            },
            "alt_text": "Deux ampoules A et B alimentées par une pile, avec un interrupteur en dérivation de B",
            "insertion_token": "asset:phys-003-circuit"
          }
        ],
        "source_pages": [
          3
        ],
        "confidence": 0.98,
        "warnings": [
          "La réponse correcte n’est pas explicitement indiquée dans le document."
        ],
        "status": "draft"
      },
      "rationale": "Association d’un énoncé en deux parties avec un circuit central."
    },
    {
      "case_id": "phys-005",
      "document_id": "physics-slides",
      "source_label": "Diapositive 5",
      "mapping_fragment": {
        "temporary_id": "segment-phys-005",
        "question_number": null,
        "question_pages": [
          5
        ],
        "answer_pages": [],
        "feedback_pages": [],
        "contains_essential_image": true,
        "question_type_hint": "single_choice",
        "page_regions": [
          {
            "page": 5,
            "role": "question",
            "bbox": {
              "x": 0.03,
              "y": 0.12,
              "width": 0.93,
              "height": 0.78
            }
          },
          {
            "page": 5,
            "role": "essential_image",
            "bbox": {
              "x": 0.58,
              "y": 0.31,
              "width": 0.28,
              "height": 0.48
            }
          }
        ],
        "confidence": 0.98,
        "warnings": []
      },
      "expected_question": {
        "id": "q-phys-005",
        "segment_id": "segment-phys-005",
        "type": "single_choice",
        "title": {
          "content": "Initialement l’interrupteur est ouvert et les ampoules éteintes. Je f…",
          "origin": "generated_by_model"
        },
        "content_format": "markdown-latex",
        "statement": "Initialement l’interrupteur est ouvert et les ampoules éteintes. Je ferme l’interrupteur. Quelle ampoule s’allume la première ?\n\n![Circuit de deux ampoules en série](asset:phys-005-circuit)",
        "choices": [
          {
            "id": "choice-a",
            "content": "L’ampoule A"
          },
          {
            "id": "choice-b",
            "content": "L’ampoule B"
          },
          {
            "id": "choice-c",
            "content": "Les deux s’allument en même temps"
          }
        ],
        "correct_choice_ids": [],
        "correct_answer_origin": "not_available",
        "feedback": {
          "content": "",
          "origin": "not_available"
        },
        "images": [
          {
            "id": "asset-phys-005-circuit",
            "role": "essential",
            "source_page": 5,
            "bbox": {
              "x": 0.58,
              "y": 0.31,
              "width": 0.28,
              "height": 0.48
            },
            "alt_text": "Pile, interrupteur et deux ampoules A et B montées en série",
            "insertion_token": "asset:phys-005-circuit"
          }
        ],
        "source_pages": [
          5
        ],
        "confidence": 0.98,
        "warnings": [
          "La réponse correcte n’est pas explicitement indiquée dans le document."
        ],
        "status": "draft"
      },
      "rationale": "Question conceptuelle avec schéma vertical et choix sur plusieurs lignes."
    },
    {
      "case_id": "phys-010",
      "document_id": "physics-slides",
      "source_label": "Diapositive 10",
      "mapping_fragment": {
        "temporary_id": "segment-phys-010",
        "question_number": null,
        "question_pages": [
          10
        ],
        "answer_pages": [],
        "feedback_pages": [],
        "contains_essential_image": true,
        "question_type_hint": "single_choice",
        "page_regions": [
          {
            "page": 10,
            "role": "question",
            "bbox": {
              "x": 0.03,
              "y": 0.14,
              "width": 0.93,
              "height": 0.75
            }
          },
          {
            "page": 10,
            "role": "essential_image",
            "bbox": {
              "x": 0.53,
              "y": 0.24,
              "width": 0.36,
              "height": 0.5
            }
          }
        ],
        "confidence": 0.98,
        "warnings": []
      },
      "expected_question": {
        "id": "q-phys-010",
        "segment_id": "segment-phys-010",
        "type": "single_choice",
        "title": {